false,123e4567-e89b-12d3-a456-426614174000,Naruto Uzumaki embarks on a journey to become the strongest ninja and gain the respect of his village,Naruto
false,234e5678-e89b-12d3-a456-426614174001,Luffy and his crew search for the legendary treasure the One Piece to become the Pirate King,One Piece
false,345e6789-e89b-12d3-a456-426614174002,In a world where humanity is on the brink of extinction Eren Yeager fights against the Titans that threaten to wipe them out,Attack on Titan
false,456e7890-e89b-12d3-a456-426614174003,In a world where nearly everyone has superpowers a young boy without powers dreams of becoming a hero,My Hero Academia
false,567e7891-e89b-12d3-a456-426614174004,Light Yagami gains the power to kill anyone whose name he writes in a mystical notebook leading him into a deadly game with law enforcement,Death Note
false,678e8902-e89b-12d3-a456-426614174005,Two brothers use alchemy in search of the Philosopher's Stone to restore their bodies after a failed experiment,Fullmetal Alchemist